[I 2025-05-22 20:22:32,792] Trial 14 finished with value: 0.9649014778325123 and parameters: {'lr': 0.0015767014577461056, 'dropout_rate': 0.3603133589650639, 'optimizer': 'Adam', 'weight_decay': 0.0003392890601986676, 'label_smoothing': 0.15606669898546305}. Best is trial 13 with value: 0.9661330049261084.

Deneme 15: lr=0.000905, dropout=0.207, opt=Adam, wd=0.0003963, ls=0.200
  Deneme 15 - Epoch 1/15 -> Val Acc: 0.9335, Val Loss: 0.2983, Train Loss: 0.5535
  Deneme 15 - Epoch 2/15 -> Val Acc: 0.9514, Val Loss: 0.2172, Train Loss: 0.5104
  Deneme 15 - Epoch 3/15 -> Val Acc: 0.9218, Val Loss: 0.3049, Train Loss: 0.4996
  Deneme 15 - Epoch 4/15 -> Val Acc: 0.9575, Val Loss: 0.2300, Train Loss: 0.4931
  Deneme 15 - Epoch 5/15 -> Val Acc: 0.9538, Val Loss: 0.1957, Train Loss: 0.4910
  Deneme 15 - Epoch 6/15 -> Val Acc: 0.9612, Val Loss: 0.1983, Train Loss: 0.4840
  Deneme 15 - Epoch 7/15 -> Val Acc: 0.9618, Val Loss: 0.2384, Train Loss: 0.4801
  Deneme 15 - Epoch 8/15 -> Val Acc: 0.9557, Val Loss: 0.1868, Train Loss: 0.4770
  Deneme 15 - Epoch 9/15 -> Val Acc: 0.9637, Val Loss: 0.1848, Train Loss: 0.4739
  Deneme 15 - Epoch 10/15 -> Val Acc: 0.9643, Val Loss: 0.1921, Train Loss: 0.4725
  Deneme 15 - Epoch 11/15 -> Val Acc: 0.9631, Val Loss: 0.2004, Train Loss: 0.4689
  Deneme 15 - Epoch 12/15 -> Val Acc: 0.9667, Val Loss: 0.2021, Train Loss: 0.4703
  Deneme 15 - Epoch 13/15 -> Val Acc: 0.9674, Val Loss: 0.1891, Train Loss: 0.4732
  Deneme 15 - Epoch 14/15 -> Val Acc: 0.9631, Val Loss: 0.2036, Train Loss: 0.4669
  Deneme 15 - Epoch 15/15 -> Val Acc: 0.9587, Val Loss: 0.2140, Train Loss: 0.4626
[I 2025-05-22 20:28:33,961] Trial 15 finished with value: 0.9673645320197044 and parameters: {'lr': 0.0009047136638192376, 'dropout_rate': 0.20685851661129578, 'optimizer': 'Adam', 'weight_decay': 0.00039626789083630436, 'label_smoothing': 0.19955733652140992}. Best is trial 15 with value: 0.9673645320197044.

Deneme 16: lr=0.001063, dropout=0.171, opt=Adam, wd=0.0002770, ls=0.154
  Deneme 16 - Epoch 1/15 -> Val Acc: 0.9495, Val Loss: 0.2563, Train Loss: 0.5510
  Deneme 16 - Epoch 2/15 -> Val Acc: 0.9538, Val Loss: 0.2224, Train Loss: 0.4823
  Deneme 16 - Epoch 3/15 -> Val Acc: 0.9544, Val Loss: 0.1979, Train Loss: 0.4707
  Deneme 16 - Epoch 4/15 -> Val Acc: 0.9569, Val Loss: 0.1974, Train Loss: 0.4614
  Deneme 16 - Epoch 5/15 -> Val Acc: 0.9594, Val Loss: 0.1758, Train Loss: 0.4611
  Deneme 16 - Epoch 6/15 -> Val Acc: 0.9477, Val Loss: 0.1802, Train Loss: 0.4491
  Deneme 16 - Epoch 7/15 -> Val Acc: 0.9569, Val Loss: 0.1845, Train Loss: 0.4527
  Deneme 16 - Epoch 8/15 -> Val Acc: 0.9643, Val Loss: 0.1699, Train Loss: 0.4471
  Deneme 16 - Epoch 9/15 -> Val Acc: 0.9501, Val Loss: 0.2273, Train Loss: 0.4455
  Deneme 16 - Epoch 10/15 -> Val Acc: 0.9612, Val Loss: 0.1780, Train Loss: 0.4355
  Deneme 16 - Epoch 11/15 -> Val Acc: 0.9661, Val Loss: 0.1769, Train Loss: 0.4363
  Deneme 16 - Epoch 12/15 -> Val Acc: 0.9643, Val Loss: 0.1704, Train Loss: 0.4359
  Deneme 16 - Epoch 13/15 -> Val Acc: 0.9655, Val Loss: 0.1560, Train Loss: 0.4345
  Deneme 16 - Epoch 14/15 -> Val Acc: 0.9655, Val Loss: 0.1721, Train Loss: 0.4314
  Deneme 16 - Epoch 15/15 -> Val Acc: 0.9661, Val Loss: 0.1470, Train Loss: 0.4195
[I 2025-05-22 20:34:37,272] Trial 16 finished with value: 0.9661330049261084 and parameters: {'lr': 0.0010633534830988937, 'dropout_rate': 0.17115795819849974, 'optimizer': 'Adam', 'weight_decay': 0.0002769542495068015, 'label_smoothing': 0.15401056576260935}. Best is trial 15 with value: 0.9673645320197044.

Deneme 17: lr=0.000128, dropout=0.198, opt=Adam, wd=0.0001987, ls=0.132
  Deneme 17 - Epoch 1/15 -> Val Acc: 0.8953, Val Loss: 0.3876, Train Loss: 0.5827
  Deneme 17 - Epoch 2/15 -> Val Acc: 0.9421, Val Loss: 0.2616, Train Loss: 0.4913
  Deneme 17 - Epoch 3/15 -> Val Acc: 0.9520, Val Loss: 0.2259, Train Loss: 0.4686
  Deneme 17 - Epoch 4/15 -> Val Acc: 0.9550, Val Loss: 0.2281, Train Loss: 0.4619
  Deneme 17 - Epoch 5/15 -> Val Acc: 0.9569, Val Loss: 0.2282, Train Loss: 0.4543
  Deneme 17 - Epoch 6/15 -> Val Acc: 0.9544, Val Loss: 0.2191, Train Loss: 0.4528
  Deneme 17 - Epoch 7/15 -> Val Acc: 0.9501, Val Loss: 0.2182, Train Loss: 0.4427
  Deneme 17 - Epoch 8/15 -> Val Acc: 0.9587, Val Loss: 0.2019, Train Loss: 0.4480
  Deneme 17 - Epoch 9/15 -> Val Acc: 0.9649, Val Loss: 0.1966, Train Loss: 0.4407
  Deneme 17 - Epoch 10/15 -> Val Acc: 0.9575, Val Loss: 0.1800, Train Loss: 0.4310
  Deneme 17 - Epoch 11/15 -> Val Acc: 0.9612, Val Loss: 0.1845, Train Loss: 0.4336
  Deneme 17 - Epoch 12/15 -> Val Acc: 0.9563, Val Loss: 0.2014, Train Loss: 0.4294
  Deneme 17 - Epoch 13/15 -> Val Acc: 0.9612, Val Loss: 0.1773, Train Loss: 0.4245
  Deneme 17 - Epoch 14/15 -> Val Acc: 0.9600, Val Loss: 0.1763, Train Loss: 0.4261
  Deneme 17 erken durduruldu epoch 14.
[I 2025-05-22 20:40:13,439] Trial 17 finished with value: 0.9649014778325123 and parameters: {'lr': 0.00012833813129868978, 'dropout_rate': 0.1975605597912398, 'optimizer': 'Adam', 'weight_decay': 0.0001986986029255202, 'label_smoothing': 0.13158220984866498}. Best is trial 15 with value: 0.9673645320197044.

Deneme 18: lr=0.009499, dropout=0.450, opt=Adam, wd=0.0004938, ls=0.057
  Deneme 18 - Epoch 1/15 -> Val Acc: 0.9230, Val Loss: 0.2363, Train Loss: 0.5978
  Deneme 18 - Epoch 2/15 -> Val Acc: 0.7913, Val Loss: 0.4335, Train Loss: 0.5290
  Deneme 18 - Epoch 3/15 -> Val Acc: 0.9415, Val Loss: 0.2245, Train Loss: 0.5061
  Deneme 18 - Epoch 4/15 -> Val Acc: 0.9169, Val Loss: 0.2028, Train Loss: 0.4914
  Deneme 18 budandı (pruned) epoch 4.
[I 2025-05-22 20:41:49,970] Trial 18 pruned.

Deneme 19: lr=0.000916, dropout=0.335, opt=Adam, wd=0.0000844, ls=0.174
  Deneme 19 - Epoch 1/15 -> Val Acc: 0.9144, Val Loss: 0.3251, Train Loss: 0.5479
  Deneme 19 - Epoch 2/15 -> Val Acc: 0.8701, Val Loss: 0.3481, Train Loss: 0.4924
  Deneme 19 - Epoch 3/15 -> Val Acc: 0.9526, Val Loss: 0.2163, Train Loss: 0.4877
  Deneme 19 - Epoch 4/15 -> Val Acc: 0.9581, Val Loss: 0.1895, Train Loss: 0.4783
  Deneme 19 - Epoch 5/15 -> Val Acc: 0.9661, Val Loss: 0.1786, Train Loss: 0.4634
  Deneme 19 - Epoch 6/15 -> Val Acc: 0.9674, Val Loss: 0.1805, Train Loss: 0.4605
  Deneme 19 - Epoch 7/15 -> Val Acc: 0.9618, Val Loss: 0.1664, Train Loss: 0.4580
  Deneme 19 - Epoch 8/15 -> Val Acc: 0.9600, Val Loss: 0.1720, Train Loss: 0.4502
  Deneme 19 - Epoch 9/15 -> Val Acc: 0.9618, Val Loss: 0.1704, Train Loss: 0.4543
  Deneme 19 - Epoch 10/15 -> Val Acc: 0.9680, Val Loss: 0.1621, Train Loss: 0.4485
  Deneme 19 - Epoch 11/15 -> Val Acc: 0.9674, Val Loss: 0.1966, Train Loss: 0.4447
  Deneme 19 - Epoch 12/15 -> Val Acc: 0.9698, Val Loss: 0.1651, Train Loss: 0.4386
  Deneme 19 - Epoch 13/15 -> Val Acc: 0.9717, Val Loss: 0.1627, Train Loss: 0.4374
  Deneme 19 - Epoch 14/15 -> Val Acc: 0.9698, Val Loss: 0.1603, Train Loss: 0.4394
  Deneme 19 - Epoch 15/15 -> Val Acc: 0.9729, Val Loss: 0.1511, Train Loss: 0.4348
[I 2025-05-22 20:47:50,397] Trial 19 finished with value: 0.9729064039408867 and parameters: {'lr': 0.0009161687803640246, 'dropout_rate': 0.3352705138027818, 'optimizer': 'Adam', 'weight_decay': 8.442913930570078e-05, 'label_smoothing': 0.17395784530393882}. Best is trial 19 with value: 0.9729064039408867.

Deneme 20: lr=0.000958, dropout=0.157, opt=Adam, wd=0.0000144, ls=0.164
  Deneme 20 - Epoch 1/15 -> Val Acc: 0.9150, Val Loss: 0.3056, Train Loss: 0.5396
  Deneme 20 - Epoch 2/15 -> Val Acc: 0.9569, Val Loss: 0.2172, Train Loss: 0.4892
  Deneme 20 - Epoch 3/15 -> Val Acc: 0.9495, Val Loss: 0.1980, Train Loss: 0.4703
  Deneme 20 - Epoch 4/15 -> Val Acc: 0.9544, Val Loss: 0.2111, Train Loss: 0.4579
  Deneme 20 - Epoch 5/15 -> Val Acc: 0.9624, Val Loss: 0.1725, Train Loss: 0.4568
  Deneme 20 - Epoch 6/15 -> Val Acc: 0.9661, Val Loss: 0.1817, Train Loss: 0.4474
  Deneme 20 - Epoch 7/15 -> Val Acc: 0.9544, Val Loss: 0.1632, Train Loss: 0.4385
  Deneme 20 - Epoch 8/15 -> Val Acc: 0.9594, Val Loss: 0.1556, Train Loss: 0.4361
  Deneme 20 - Epoch 9/15 -> Val Acc: 0.9667, Val Loss: 0.1775, Train Loss: 0.4322
  Deneme 20 - Epoch 10/15 -> Val Acc: 0.9698, Val Loss: 0.1514, Train Loss: 0.4275
  Deneme 20 - Epoch 11/15 -> Val Acc: 0.9692, Val Loss: 0.1578, Train Loss: 0.4244
  Deneme 20 - Epoch 12/15 -> Val Acc: 0.9723, Val Loss: 0.1628, Train Loss: 0.4304
  Deneme 20 - Epoch 13/15 -> Val Acc: 0.9748, Val Loss: 0.1639, Train Loss: 0.4278
  Deneme 20 - Epoch 14/15 -> Val Acc: 0.9711, Val Loss: 0.1439, Train Loss: 0.4219
  Deneme 20 - Epoch 15/15 -> Val Acc: 0.9674, Val Loss: 0.1561, Train Loss: 0.4186
[I 2025-05-22 20:53:47,341] Trial 20 finished with value: 0.9747536945812808 and parameters: {'lr': 0.0009584328414665062, 'dropout_rate': 0.15651476619456378, 'optimizer': 'Adam', 'weight_decay': 1.4369691709542386e-05, 'label_smoothing': 0.16402753304127335}. Best is trial 20 with value: 0.9747536945812808.

Deneme 21: lr=0.000951, dropout=0.145, opt=Adam, wd=0.0000133, ls=0.170
  Deneme 21 - Epoch 1/15 -> Val Acc: 0.9427, Val Loss: 0.2296, Train Loss: 0.5405
  Deneme 21 - Epoch 2/15 -> Val Acc: 0.9550, Val Loss: 0.2093, Train Loss: 0.4808
  Deneme 21 - Epoch 3/15 -> Val Acc: 0.9612, Val Loss: 0.2000, Train Loss: 0.4705
  Deneme 21 - Epoch 4/15 -> Val Acc: 0.9618, Val Loss: 0.1867, Train Loss: 0.4633
  Deneme 21 - Epoch 5/15 -> Val Acc: 0.9594, Val Loss: 0.2139, Train Loss: 0.4552
  Deneme 21 - Epoch 6/15 -> Val Acc: 0.9514, Val Loss: 0.1803, Train Loss: 0.4466
  Deneme 21 - Epoch 7/15 -> Val Acc: 0.9692, Val Loss: 0.1668, Train Loss: 0.4469
  Deneme 21 - Epoch 8/15 -> Val Acc: 0.9649, Val Loss: 0.1622, Train Loss: 0.4359
  Deneme 21 - Epoch 9/15 -> Val Acc: 0.9723, Val Loss: 0.1657, Train Loss: 0.4423
  Deneme 21 - Epoch 10/15 -> Val Acc: 0.9655, Val Loss: 0.1692, Train Loss: 0.4411
  Deneme 21 - Epoch 11/15 -> Val Acc: 0.9698, Val Loss: 0.1530, Train Loss: 0.4306
  Deneme 21 - Epoch 12/15 -> Val Acc: 0.9698, Val Loss: 0.1716, Train Loss: 0.4303
  Deneme 21 - Epoch 13/15 -> Val Acc: 0.9729, Val Loss: 0.1539, Train Loss: 0.4236
  Deneme 21 - Epoch 14/15 -> Val Acc: 0.9754, Val Loss: 0.1453, Train Loss: 0.4197
  Deneme 21 - Epoch 15/15 -> Val Acc: 0.9778, Val Loss: 0.1470, Train Loss: 0.4210
[I 2025-05-22 20:59:50,468] Trial 21 finished with value: 0.9778325123152709 and parameters: {'lr': 0.000950778784118598, 'dropout_rate': 0.14540764515649876, 'optimizer': 'Adam', 'weight_decay': 1.3338318976818048e-05, 'label_smoothing': 0.16976663285266777}. Best is trial 21 with value: 0.9778325123152709.

Deneme 22: lr=0.002410, dropout=0.155, opt=Adam, wd=0.0000137, ls=0.168
  Deneme 22 - Epoch 1/15 -> Val Acc: 0.9446, Val Loss: 0.2205, Train Loss: 0.5364
  Deneme 22 - Epoch 2/15 -> Val Acc: 0.9427, Val Loss: 0.2365, Train Loss: 0.4837
  Deneme 22 - Epoch 3/15 -> Val Acc: 0.9520, Val Loss: 0.2071, Train Loss: 0.4725
  Deneme 22 - Epoch 4/15 -> Val Acc: 0.9526, Val Loss: 0.1898, Train Loss: 0.4635
  Deneme 22 budandı (pruned) epoch 4.
[I 2025-05-22 21:01:27,821] Trial 22 pruned.

Deneme 23: lr=0.000719, dropout=0.113, opt=Adam, wd=0.0000151, ls=0.117
  Deneme 23 - Epoch 1/15 -> Val Acc: 0.9440, Val Loss: 0.2352, Train Loss: 0.5295
  Deneme 23 - Epoch 2/15 -> Val Acc: 0.9495, Val Loss: 0.2226, Train Loss: 0.4506
  Deneme 23 - Epoch 3/15 -> Val Acc: 0.9427, Val Loss: 0.2189, Train Loss: 0.4446
  Deneme 23 - Epoch 4/15 -> Val Acc: 0.9631, Val Loss: 0.1680, Train Loss: 0.4274
  Deneme 23 - Epoch 5/15 -> Val Acc: 0.9600, Val Loss: 0.1535, Train Loss: 0.4267
  Deneme 23 - Epoch 6/15 -> Val Acc: 0.9649, Val Loss: 0.1458, Train Loss: 0.4126
  Deneme 23 - Epoch 7/15 -> Val Acc: 0.9575, Val Loss: 0.1428, Train Loss: 0.4083
  Deneme 23 - Epoch 8/15 -> Val Acc: 0.9631, Val Loss: 0.1374, Train Loss: 0.4007
  Deneme 23 - Epoch 9/15 -> Val Acc: 0.9618, Val Loss: 0.1336, Train Loss: 0.3948
  Deneme 23 - Epoch 10/15 -> Val Acc: 0.9698, Val Loss: 0.1425, Train Loss: 0.3881
  Deneme 23 - Epoch 11/15 -> Val Acc: 0.9717, Val Loss: 0.1360, Train Loss: 0.3842
  Deneme 23 - Epoch 12/15 -> Val Acc: 0.9723, Val Loss: 0.1404, Train Loss: 0.3746
  Deneme 23 - Epoch 13/15 -> Val Acc: 0.9686, Val Loss: 0.1285, Train Loss: 0.3826
  Deneme 23 - Epoch 14/15 -> Val Acc: 0.9698, Val Loss: 0.1395, Train Loss: 0.3785
  Deneme 23 - Epoch 15/15 -> Val Acc: 0.9674, Val Loss: 0.1667, Train Loss: 0.3796
[I 2025-05-22 21:07:31,529] Trial 23 finished with value: 0.9722906403940886 and parameters: {'lr': 0.0007193569355432667, 'dropout_rate': 0.11260053398706135, 'optimizer': 'Adam', 'weight_decay': 1.5116406030018258e-05, 'label_smoothing': 0.11715299567297055}. Best is trial 21 with value: 0.9778325123152709.

Deneme 24: lr=0.000149, dropout=0.242, opt=Adam, wd=0.0000010, ls=0.150
  Deneme 24 - Epoch 1/15 -> Val Acc: 0.8879, Val Loss: 0.3960, Train Loss: 0.5821
  Deneme 24 - Epoch 2/15 -> Val Acc: 0.9464, Val Loss: 0.2586, Train Loss: 0.4975
  Deneme 24 - Epoch 3/15 -> Val Acc: 0.9557, Val Loss: 0.2522, Train Loss: 0.4766
  Deneme 24 - Epoch 4/15 -> Val Acc: 0.9557, Val Loss: 0.2079, Train Loss: 0.4652
  Deneme 24 budandı (pruned) epoch 4.

--- Optuna Çalışması Tamamlandı! ---
En İyi Deneme Numarası: 21
En İyi Değer (Max Val Accuracy): 0.9778
En İyi Hiperparametreler:
  lr: 0.000950778784118598
  dropout_rate: 0.14540764515649876
  optimizer: Adam
  weight_decay: 1.3338318976818048e-05
  label_smoothing: 0.16976663285266777

--- Final Eğitim Başlıyor ---
Cihaz: cuda
En İyi Hiperparametreler: {'lr': 0.000950778784118598, 'dropout_rate': 0.14540764515649876, 'optimizer': 'Adam', 'weight_decay': 1.3338318976818048e-05, 'label_smoothing': 0.16976663285266777}
[I 2025-05-22 21:09:08,712] Trial 24 pruned.
Final eğitim sıfırdan başlıyor (checkpoint yok veya yükleme kapalı).
/home/nurullah/miniconda3/envs/dpvo/lib/python3.10/site-packages/torch/optim/lr_scheduler.py:28: UserWarning: The verbose parameter is deprecated. Please use get_last_lr() to access the learning rate.
  warnings.warn("The verbose parameter is deprecated. Please use get_last_lr() "
Final Eğitim - Epoch 1/50: Train Loss: 0.5287 | Val Loss: 0.3139 | Val Acc: 0.9027 | Prec: 0.7667 | Rec: 0.9360 | F1: 0.8429
  En iyi final model kaydedildi: son_en_iyi_model.pth, Val Acc: 0.9027
Final Eğitim - Epoch 2/50: Train Loss: 0.4972 | Val Loss: 0.2273 | Val Acc: 0.9532 | Prec: 0.9435 | Rec: 0.8852 | F1: 0.9134
  En iyi final model kaydedildi: son_en_iyi_model.pth, Val Acc: 0.9532
Final Eğitim - Epoch 3/50: Train Loss: 0.4750 | Val Loss: 0.1978 | Val Acc: 0.9581 | Prec: 0.9487 | Rec: 0.8985 | F1: 0.9229
  En iyi final model kaydedildi: son_en_iyi_model.pth, Val Acc: 0.9581
Final Eğitim - Epoch 4/50: Train Loss: 0.4679 | Val Loss: 0.1870 | Val Acc: 0.9569 | Prec: 0.9873 | Rec: 0.8565 | F1: 0.9173
Final Eğitim - Epoch 5/50: Train Loss: 0.4577 | Val Loss: 0.1806 | Val Acc: 0.9581 | Prec: 0.9684 | Rec: 0.8786 | F1: 0.9213
Final Eğitim - Epoch 6/50: Train Loss: 0.4466 | Val Loss: 0.1580 | Val Acc: 0.9649 | Prec: 0.9806 | Rec: 0.8918 | F1: 0.9341
  En iyi final model kaydedildi: son_en_iyi_model.pth, Val Acc: 0.9649
Final Eğitim - Epoch 7/50: Train Loss: 0.4399 | Val Loss: 0.1572 | Val Acc: 0.9643 | Prec: 0.9901 | Rec: 0.8808 | F1: 0.9322
Final Eğitim - Epoch 8/50: Train Loss: 0.4448 | Val Loss: 0.2395 | Val Acc: 0.9526 | Prec: 0.8775 | Rec: 0.9647 | F1: 0.9190
Final Eğitim - Epoch 9/50: Train Loss: 0.4470 | Val Loss: 0.1726 | Val Acc: 0.9717 | Prec: 0.9744 | Rec: 0.9227 | F1: 0.9478
  En iyi final model kaydedildi: son_en_iyi_model.pth, Val Acc: 0.9717
Final Eğitim - Epoch 10/50: Train Loss: 0.4353 | Val Loss: 0.1526 | Val Acc: 0.9717 | Prec: 0.9788 | Rec: 0.9183 | F1: 0.9476
Final Eğitim - Epoch 11/50: Train Loss: 0.4347 | Val Loss: 0.1665 | Val Acc: 0.9711 | Prec: 0.9552 | Rec: 0.9404 | F1: 0.9477
Final Eğitim - Epoch 12/50: Train Loss: 0.4307 | Val Loss: 0.1481 | Val Acc: 0.9698 | Prec: 0.9879 | Rec: 0.9029 | F1: 0.9435
Final Eğitim - Epoch 13/50: Train Loss: 0.4270 | Val Loss: 0.1530 | Val Acc: 0.9741 | Prec: 0.9905 | Rec: 0.9161 | F1: 0.9518
  En iyi final model kaydedildi: son_en_iyi_model.pth, Val Acc: 0.9741
Final Eğitim - Epoch 14/50: Train Loss: 0.4260 | Val Loss: 0.1633 | Val Acc: 0.9680 | Prec: 0.9588 | Rec: 0.9249 | F1: 0.9416
Final Eğitim - Epoch 15/50: Train Loss: 0.4213 | Val Loss: 0.1564 | Val Acc: 0.9760 | Prec: 0.9770 | Rec: 0.9360 | F1: 0.9560
  En iyi final model kaydedildi: son_en_iyi_model.pth, Val Acc: 0.9760
Final Eğitim - Epoch 16/50: Train Loss: 0.4217 | Val Loss: 0.1442 | Val Acc: 0.9698 | Prec: 0.9833 | Rec: 0.9073 | F1: 0.9437
Final Eğitim - Epoch 17/50: Train Loss: 0.4263 | Val Loss: 0.1545 | Val Acc: 0.9741 | Prec: 0.9813 | Rec: 0.9249 | F1: 0.9523
Final Eğitim - Epoch 18/50: Train Loss: 0.4139 | Val Loss: 0.1387 | Val Acc: 0.9711 | Prec: 0.9927 | Rec: 0.9029 | F1: 0.9457
Final Eğitim - Epoch 19/50: Train Loss: 0.4194 | Val Loss: 0.1333 | Val Acc: 0.9760 | Prec: 0.9929 | Rec: 0.9205 | F1: 0.9553
Final Eğitim - Epoch 20/50: Train Loss: 0.4169 | Val Loss: 0.1450 | Val Acc: 0.9778 | Prec: 0.9771 | Rec: 0.9426 | F1: 0.9596
  En iyi final model kaydedildi: son_en_iyi_model.pth, Val Acc: 0.9778
Final Eğitim - Epoch 21/50: Train Loss: 0.4150 | Val Loss: 0.1512 | Val Acc: 0.9791 | Prec: 0.9816 | Rec: 0.9426 | F1: 0.9617
  En iyi final model kaydedildi: son_en_iyi_model.pth, Val Acc: 0.9791
Final Eğitim - Epoch 22/50: Train Loss: 0.4129 | Val Loss: 0.1417 | Val Acc: 0.9760 | Prec: 0.9859 | Rec: 0.9272 | F1: 0.9556
Final Eğitim - Epoch 23/50: Train Loss: 0.4167 | Val Loss: 0.1460 | Val Acc: 0.9754 | Prec: 0.9814 | Rec: 0.9294 | F1: 0.9546
Final Eğitim - Epoch 24/50: Train Loss: 0.4164 | Val Loss: 0.1685 | Val Acc: 0.9772 | Prec: 0.9561 | Rec: 0.9625 | F1: 0.9593
Final Eğitim - Epoch 25/50: Train Loss: 0.4062 | Val Loss: 0.1367 | Val Acc: 0.9797 | Prec: 0.9953 | Rec: 0.9316 | F1: 0.9624
  En iyi final model kaydedildi: son_en_iyi_model.pth, Val Acc: 0.9797
Final Eğitim - Epoch 26/50: Train Loss: 0.4150 | Val Loss: 0.1425 | Val Acc: 0.9772 | Prec: 0.9815 | Rec: 0.9360 | F1: 0.9582
Final Eğitim - Epoch 27/50: Train Loss: 0.4091 | Val Loss: 0.1345 | Val Acc: 0.9797 | Prec: 0.9817 | Rec: 0.9448 | F1: 0.9629
Final Eğitim - Epoch 28/50: Train Loss: 0.4083 | Val Loss: 0.1322 | Val Acc: 0.9704 | Prec: 0.9951 | Rec: 0.8985 | F1: 0.9443
Final Eğitim - Epoch 29/50: Train Loss: 0.4150 | Val Loss: 0.1399 | Val Acc: 0.9791 | Prec: 0.9838 | Rec: 0.9404 | F1: 0.9616
Final Eğitim - Epoch 30/50: Train Loss: 0.4084 | Val Loss: 0.1518 | Val Acc: 0.9809 | Prec: 0.9795 | Rec: 0.9514 | F1: 0.9653
  En iyi final model kaydedildi: son_en_iyi_model.pth, Val Acc: 0.9809
Final Eğitim - Epoch 31/50: Train Loss: 0.4101 | Val Loss: 0.1697 | Val Acc: 0.9791 | Prec: 0.9645 | Rec: 0.9603 | F1: 0.9624
Final Eğitim - Epoch 32/50: Train Loss: 0.4067 | Val Loss: 0.1331 | Val Acc: 0.9778 | Prec: 0.9883 | Rec: 0.9316 | F1: 0.9591
Final Eğitim - Epoch 33/50: Train Loss: 0.4037 | Val Loss: 0.1580 | Val Acc: 0.9821 | Prec: 0.9862 | Rec: 0.9492 | F1: 0.9674
  En iyi final model kaydedildi: son_en_iyi_model.pth, Val Acc: 0.9821
Final Eğitim - Epoch 34/50: Train Loss: 0.4063 | Val Loss: 0.1387 | Val Acc: 0.9784 | Prec: 0.9906 | Rec: 0.9316 | F1: 0.9602
Final Eğitim - Epoch 35/50: Train Loss: 0.4101 | Val Loss: 0.1356 | Val Acc: 0.9803 | Prec: 0.9884 | Rec: 0.9404 | F1: 0.9638
Final Eğitim - Epoch 36/50: Train Loss: 0.4038 | Val Loss: 0.1412 | Val Acc: 0.9815 | Prec: 0.9885 | Rec: 0.9448 | F1: 0.9661
Final Eğitim - Epoch 37/50: Train Loss: 0.3988 | Val Loss: 0.1449 | Val Acc: 0.9840 | Prec: 0.9819 | Rec: 0.9603 | F1: 0.9710
  En iyi final model kaydedildi: son_en_iyi_model.pth, Val Acc: 0.9840
Final Eğitim - Epoch 38/50: Train Loss: 0.4063 | Val Loss: 0.1464 | Val Acc: 0.9821 | Prec: 0.9796 | Rec: 0.9558 | F1: 0.9676
Final Eğitim - Epoch 39/50: Train Loss: 0.4092 | Val Loss: 0.1364 | Val Acc: 0.9772 | Prec: 0.9837 | Rec: 0.9338 | F1: 0.9581
Final Eğitim - Epoch 40/50: Train Loss: 0.4056 | Val Loss: 0.1654 | Val Acc: 0.9791 | Prec: 0.9666 | Rec: 0.9581 | F1: 0.9623
Final Eğitim - Epoch 41/50: Train Loss: 0.4046 | Val Loss: 0.1339 | Val Acc: 0.9760 | Prec: 0.9882 | Rec: 0.9249 | F1: 0.9555
Final Eğitim - Epoch 42/50: Train Loss: 0.4022 | Val Loss: 0.1378 | Val Acc: 0.9784 | Prec: 0.9838 | Rec: 0.9382 | F1: 0.9605
Final Eğitim - Epoch 43/50: Train Loss: 0.3999 | Val Loss: 0.1457 | Val Acc: 0.9828 | Prec: 0.9775 | Rec: 0.9603 | F1: 0.9688
Final Eğitim - Epoch 44/50: Train Loss: 0.4003 | Val Loss: 0.1346 | Val Acc: 0.9797 | Prec: 0.9861 | Rec: 0.9404 | F1: 0.9627
Final Eğitim - Epoch 45/50: Train Loss: 0.3952 | Val Loss: 0.1310 | Val Acc: 0.9821 | Prec: 0.9907 | Rec: 0.9448 | F1: 0.9672
Final Eğitim - Epoch 46/50: Train Loss: 0.3955 | Val Loss: 0.1356 | Val Acc: 0.9815 | Prec: 0.9862 | Rec: 0.9470 | F1: 0.9662
Final Eğitim - Epoch 47/50: Train Loss: 0.3955 | Val Loss: 0.1418 | Val Acc: 0.9834 | Prec: 0.9863 | Rec: 0.9536 | F1: 0.9697
  Final eğitim erken durduruldu epoch 47.
Final eğitim tamamlandı. En iyi doğrulama doğruluğu: 0.9840

--- Final Model Test Seti Değerlendirmesi ---

--- Test (Final Model) Sonuçları ---
Doğruluk (Accuracy): 0.9766
Kesinlik (Precision): 0.9793
Duyarlılık (Recall): 0.9441
F1 Skoru: 0.9614
Karışıklık Matrisi:
  TN=1115  FP=10
  FN=28  TP=473
Karışıklık matrisi 'test_(final_model)_karisiklik_matrisi.png' olarak kaydedildi.
Sınıf indeksleri (evaluate_model): {'inilebilir': 0, 'inilemez': 1}
Test (Final Model) görüntüleri, tahmin sonuçlarına göre klasörlere kopyalandı: data/test_(final_model)_sonuclari

Tüm süreç tamamlandı.

Process finished with exit code 0
